<?xml version="1.0" encoding="utf-8"?>
<xs:schema id="params" xmlns="" xmlns:xs="http://www.w3.org/2001/XMLSchema" xmlns:msdata="urn:schemas-microsoft-com:xml-msdata">
  <xs:element name="params" msdata:IsDataSet="true" msdata:Locale="en-US">
    <xs:complexType>
      <xs:choice minOccurs="0" maxOccurs="unbounded">
        <xs:element name="param">
          <xs:complexType>
            <xs:attribute name="name" type="xs:string" />
            <xs:attribute name="value" type="xs:string" />
          </xs:complexType>
        </xs:element>
        <xs:element name="filters">
          <xs:complexType>
            <xs:sequence>
              <xs:element name="filter" minOccurs="0" maxOccurs="unbounded">
                <xs:complexType>
                  <xs:attribute name="index" type="xs:string" />
                  <xs:attribute name="name" type="xs:string" />
                  <xs:attribute name="value" type="xs:string" />
                  <xs:attribute name="visible" type="xs:string" />
                  <xs:attribute name="disabledvalue" type="xs:string" />
                  <xs:attribute name="enabled" type="xs:string" />
                  <xs:attribute name="autopostback" type="xs:string" />
                </xs:complexType>
              </xs:element>
            </xs:sequence>
          </xs:complexType>
        </xs:element>
      </xs:choice>
    </xs:complexType>
  </xs:element>
</xs:schema>