<?xml version="1.0" encoding="utf-8" ?>
<params xmlns:xsi="http://www.w3.org/2001/XMLSchema-instance" xsi:noNamespaceSchemaLocation="..\Xsd\Tree.xsd" >
  <param name="SHOWSPECIALNODES" value="N"></param>
  <param name="SHOWSPECIALNODESONSUBROOTS" value="Y"></param>
  <param name="RECURSIVEACL" value="Y"></param>
  <param name="RECURSIVEACLINCLUDEDOCUMENTS" value="N"></param>
  <param name="DRAGDROP" value="Y"></param>
  <param name="DEFAULTROOTACTION" value="Browse"></param>
  <param name="DEFAULTROOTSEARCHSCREEN" value="0"></param>
  <param name="DEFAULTROOTRESULTSCREEN" value="0"></param>
  <param name="SHOWDOCUMENTCOUNT" value="0"></param>
  <param name="ORDERBY" value="OBJ_UNAME ASC"></param>
  <param name="INITIALCOLLAPSEROOTNODE" value="Y"></param>
  <param name="HIDDENSPECIALNODES" value=""/>
    <param name="HIDEROOT" value="Y"/>
  
  <param name="SHOWFAVORITEFOLDERS" value="0"></param>
  <param name="SHOWBASKETFOLDERS" value="0"></param>
  

  <param name="SEARCHHIERARCHICAL" value="0"/>
  <param name="MAXSEARCHRESULTS" value="100"/>

  <param name="OBJECTTYPES" value="Dossier,Query"/>
  <param name="ROOT" value="Dossiers"/>
  <param name="ADVANCEDSEARCHSCREEN" value="4064188"></param>
  <filters>
    <filter index="1" name="geen folders" value="OBJ_UNAME='ARCO'" visible="true" disabledvalue="" enabled="false" autopostback="true"></filter>
  </filters>

  
</params>
